{
    "$schema": "http://json-schema.org/schema#",
    "type": "object",
    "properties": {
        "status": {
            "type": "string"
        },
        "policy": {
            "type": "object",
            "properties": {
                "name": {
                    "type": "string"
                },
                "description": {
                    "type": "string"
                }
            },
            "required": [
                "description",
                "name"
            ]
        },
        "findingKey": {
            "type": "string"
        },
        "findingId": {
            "type": "string"
        },
        "cloudGuardAccountId": {
            "type": "string"
        },
        "origin": {
            "type": "string"
        },
        "bundle": {
            "type": "object",
            "properties": {
                "name": {
                    "type": "string"
                },
                "description": {
                    "type": "string"
                },
                "id": {
                    "type": "integer"
                }
            },
            "required": [
                "description",
                "id",
                "name"
            ]
        },
        "reportTime": {
            "type": "string"
        },
        "rule": {
            "type": "object",
            "properties": {
                "name": {
                    "type": "string"
                },
                "ruleId": {
                    "type": "string"
                },
                "description": {
                    "type": "string"
                },
                "remediation": {
                    "type": "string"
                },
                "complianceTags": {
                    "type": "string"
                },
                "logicHash": {
                    "type": "string"
                },
                "severity": {
                    "type": "string"
                }
            },
            "required": [
                "complianceTags",
                "description",
                "logicHash",
                "name",
                "remediation",
                "ruleId",
                "severity"
            ]
        },
        "account": {
            "type": "object",
            "properties": {
                "id": {
                    "type": "string"
                },
                "name": {
                    "type": "string"
                },
                "vendor": {
                    "type": "string"
                },
                "dome9CloudAccountId": {
                    "type": "string"
                },
                "organizationalUnitId": {
                    "type": "string"
                },
                "organizationalUnitPath": {
                    "type": "string"
                }
            },
            "required": [
                "dome9CloudAccountId",
                "id",
                "name",
                "organizationalUnitId",
                "organizationalUnitPath",
                "vendor"
            ]
        },
        "region": {
            "type": "string"
        },
        "entity": {
            "type": "object",
            "properties": {
                "user": {
                    "type": "string"
                },
                "roleNames": {
                    "type": "array",
                    "items": {
                        "type": "string"
                    }
                },
                "auditConfigsExemption": {
                    "type": "null"
                },
                "userData": {
                    "type": "null"
                },
                "roles": {
                    "type": "array",
                    "items": {
                        "type": "object",
                        "properties": {
                            "deleted": {
                                "type": "null"
                            },
                            "description": {
                                "type": "string"
                            },
                            "eTag": {
                                "type": "string"
                            },
                            "stage": {
                                "type": "string"
                            },
                            "title": {
                                "type": "string"
                            },
                            "selfLink": {
                                "type": "null"
                            },
                            "id": {
                                "type": "string"
                            },
                            "type": {
                                "type": "string"
                            },
                            "name": {
                                "type": "string"
                            },
                            "dome9Id": {
                                "type": "string"
                            },
                            "accountNumber": {
                                "type": "string"
                            },
                            "assetLabels": {
                                "type": "null"
                            },
                            "region": {
                                "type": "string"
                            },
                            "externalFindings": {
                                "type": "null"
                            }
                        },
                        "required": [
                            "accountNumber",
                            "assetLabels",
                            "deleted",
                            "description",
                            "dome9Id",
                            "eTag",
                            "externalFindings",
                            "id",
                            "name",
                            "region",
                            "selfLink",
                            "stage",
                            "title",
                            "type"
                        ]
                    }
                },
                "selfLink": {
                    "type": "null"
                },
                "id": {
                    "type": "string"
                },
                "type": {
                    "type": "string"
                },
                "name": {
                    "type": "string"
                },
                "dome9Id": {
                    "type": "string"
                },
                "accountNumber": {
                    "type": "string"
                },
                "assetLabels": {
                    "type": "null"
                },
                "region": {
                    "type": "string"
                },
                "externalFindings": {
                    "type": "null"
                }
            },
            "required": [
                "accountNumber",
                "assetLabels",
                "auditConfigsExemption",
                "dome9Id",
                "externalFindings",
                "id",
                "name",
                "region",
                "roleNames",
                "roles",
                "selfLink",
                "type",
                "user",
                "userData"
            ]
        },
        "remediationActions": {
            "type": "array"
        },
        "action": {
            "type": "string"
        },
        "additionalFields": {
            "type": "array"
        }
    },
    "required": [
        "account",
        "action",
        "additionalFields",
        "bundle",
        "cloudGuardAccountId",
        "entity",
        "findingId",
        "findingKey",
        "origin",
        "policy",
        "region",
        "remediationActions",
        "reportTime",
        "rule",
        "status"
    ]
}