{"status":"Failed","policy":{"name":"Webhooks","description":""},"findingKey":"E4U6SBw2X1cnuxtTX2XTUw","findingId":"E4U6SBw2X1cnuxtTX2XTUw","cloudGuardAccountId":"51722","origin":"Compliance Engine","bundle":{"name":"GCP CloudGuard Best Practices","description":"CloudGuard Best Practices for securing GCP Account","id":-9},"reportTime":"2023-06-09T09:04:54.86Z","rule":{"name":"Ensure that multi-factor authentication is enabled for all non-service accounts","ruleId":"D9.GCP.IAM.03","description":"Setup multi-factor authentication for Google Cloud Platform accounts. Multi-factor authentication requires more than one mechanism to authenticate a user. This secures your logins from attackers exploiting stolen or weak credentials.","remediation":"\n**From Portal**\n1. Go to Cloud Identity and Access Management (IAM) dashboard at https://console.cloud.google.com/iam-admin/iam.\n2. Choose the PERMISSIONS tab, then select View by PRINCIPALS\n3. Copy the email address of the user account that you want to examine\n4. Go to Google Account console at https://myaccount.google.com and sign in using the email address copied at the previous step to access the appropriate user account.\n5. In the navigation bar, select Security.\n6. On the Security page, in the Signing in to Google section, check 2-Step Verification configuration setting status. set the status to On.\n7. Repeat steps no. 3 - 6 for each user account that you want to examine, created for the selected GCP project.\n\n\nNote: if the role fails because the IAMUser userData is null -\n1. It might be because you didn't connect your Google Workspace (G-Suite) account to CloudGuard.\nThis can be done through CloudGuard console -> Assets -> Environments -> <Your GCP Project> -> Add GSuite\n2. The IAMUser is not part of your organization - which is not recommended, and probably should be removed from your GCP.\n\n**References**\n1. Guide for users to enable MFA: https://support.google.com/accounts/answer/185839\n2. https://cloud.google.com/identity/solutions/enforce-mfa\n3. https://support.google.com/a/answer/9176657\n","complianceTags":"Identity and Access Management","logicHash":"IZ+YSVILn2LM2FIwhTcV5Q","severity":"High"},"account":{"id":"serious-conduit-389105","name":"GCP Demo Account NU","vendor":"GCP","dome9CloudAccountId":"ca5ef528-d8dd-41d8-a022-1a820a6adb60","organizationalUnitId":"00000000-0000-0000-0000-000000000000","organizationalUnitPath":""},"region":"Global","entity":{"user":"user:nils@nilsujma.io","roleNames":["roles/owner"],"auditConfigsExemption":null,"userData":null,"roles":[{"deleted":null,"description":"Full access to most Google Cloud resources. See the list of included permissions.","eTag":"AA==","stage":"GA","title":"Owner","selfLink":null,"id":"roles/owner","type":"GcpIamRole","name":"Owner","dome9Id":"8|ca5ef528-d8dd-41d8-a022-1a820a6adb60|GcpIamPredefinedRole|roles/owner","accountNumber":"serious-conduit-389105","assetLabels":null,"region":"Global","externalFindings":null}],"selfLink":null,"id":"IAM-USER-user:nils@nilsujma.io","type":"GcpIamUser","name":"user:nils@nilsujma.io","dome9Id":"","accountNumber":"serious-conduit-389105","assetLabels":null,"region":"Global","externalFindings":null},"remediationActions":[],"action":"Detect","additionalFields":[]}